{
  "reviewType": "privacy",
  "status": "not-started",
  "reviewAuthority": "Independent privacy reviewer to be assigned",
  "scope": [
    "decision receipts",
    "evidence references",
    "delegation graphs",
    "lifecycle events"
  ],
  "exitCriteria": [
    "Review is performed against the frozen candidate baseline.",
    "Material privacy risks and affected requirements are recorded as attributable findings.",
    "Any blocking finding has an accepted disposition and verification evidence.",
    "Reviewer attestation and evidence references are recorded."
  ],
  "gaamVersion": "0.9.0",
  "baseline": "governance/reviews/review-baseline.json",
  "reviewer": {
    "identity": "unassigned",
    "role": "independent reviewer",
    "organisation": null,
    "independence": "unassigned",
    "conflicts": []
  },
  "decisionAuthority": {
    "role": "GAAM maintainers",
    "scope": "Disposition findings, accept remediation or risk, and determine release impact under GOVERNANCE.md."
  },
  "blockingFindings": [],
  "findings": [],
  "completedAt": null,
  "evidence": [],
  "attestation": {
    "status": "not-attested",
    "recordedAt": null
  }
}
